{
  "id": "ru-home-improvement",
  "version": 1,
  "type": "payees",
  "name": {
    "en": "Russian Home Improvement",
    "ru": "Строительные магазины"
  },
  "payees": [
    {
      "key": "lemana-pro",
      "name": {
        "en": "Lemana Pro",
        "ru": "Лемана Про"
      },
      "logo": "https://catalog.kazna.app/packs/ru-home-improvement/logos/lemana-pro.png",
      "mcc": [5211, 5251],
      "website": "https://leroymerlin.ru"
    },
    {
      "key": "dom-lenta",
      "name": {
        "en": "DOM Lenta",
        "ru": "DOM Лента"
      },
      "logo": "https://catalog.kazna.app/packs/ru-home-improvement/logos/dom-lenta.png",
      "mcc": [5211, 5251],
      "website": "https://domlenta.ru"
    },
    {
      "key": "maxidom",
      "name": {
        "en": "Maxidom",
        "ru": "Максидом"
      },
      "logo": "https://catalog.kazna.app/packs/ru-home-improvement/logos/maxidom.png",
      "mcc": [5211, 5251],
      "website": "https://maxidom.ru"
    },
    {
      "key": "petrovich",
      "name": {
        "en": "Petrovich",
        "ru": "Петрович"
      },
      "logo": "https://catalog.kazna.app/packs/ru-home-improvement/logos/petrovich.png",
      "mcc": [5211],
      "website": "https://petrovich.ru"
    },
    {
      "key": "vseinstrumenty",
      "name": {
        "en": "VseInstrumenty",
        "ru": "ВсеИнструменты"
      },
      "logo": "https://catalog.kazna.app/packs/ru-home-improvement/logos/vseinstrumenty.png",
      "mcc": [5251, 5999],
      "website": "https://vseinstrumenty.ru"
    },
    {
      "key": "hoff",
      "name": {
        "en": "Hoff",
        "ru": "Хофф"
      },
      "logo": "https://catalog.kazna.app/packs/ru-home-improvement/logos/hoff.png",
      "mcc": [5712, 5719],
      "website": "https://hoff.ru"
    }
  ]
}
